"DESCRIPTION","DURATION IN MS","NAME","PARENT SUITE","START TIME","STATUS","STOP TIME","SUB SUITE","SUITE","TEST CLASS","TEST METHOD"
"","498","checking the copyright licence","chromium","2026-03-30","passed","2026-03-30","","loginModule.spec.js","",""
"","3511","Verify successful listing without description","chromium","2026-03-25","passed","2026-03-25","","sell.spec.js","",""
"","3045","only age entered","firefox","2026-03-25","passed","2026-03-25","","register.spec.js","",""
"","6263","Verify validation when only brand is provided","webkit","2026-03-25","passed","2026-03-25","","sell.spec.js","",""
"","1352","Verify direct URL navigation works","chromium","2026-03-30","passed","2026-03-30","","messgaes.spec.js","",""
"","0","checking with 3 details brandName,model and year for listing","chromium","2026-03-25","skipped","2026-03-25","","sell.spec.js","",""
"","1236","Verify chat page is visible","chromium","2026-03-30","passed","2026-03-30","","messgaes.spec.js","",""
"","1606","checking the copyright licence","firefox","2026-03-25","passed","2026-03-25","","loginModule.spec.js","",""
"","804","email and password only","chromium","2026-03-30","passed","2026-03-30","","register.spec.js","",""
"","520","Verify estimator page title","chromium","2026-03-30","passed","2026-03-30","","estimator.spec.js","",""
"","2849","fullname and age only","webkit","2026-03-25","passed","2026-03-25","","register.spec.js","",""
"","2407","email only validation","webkit","2026-03-25","passed","2026-03-25","","loginModule.spec.js","",""
"","4119","checking for the second sell bike button","firefox","2026-03-25","passed","2026-03-25","","dashboard.spec.js","",""
"","15732","Verify price estimation functionality for bike","webkit","2026-03-25","failed","2026-03-25","","sell.spec.js","",""
"","1434","Verify clicking bike opens details page","chromium","2026-03-30","passed","2026-03-30","","browsebike.spec.js","",""
"","2779","trying to register with only fullname","webkit","2026-03-25","passed","2026-03-25","","register.spec.js","",""
"","3449","checking Messages button functionality","firefox","2026-03-25","passed","2026-03-25","","dashboard.spec.js","",""
"","566","Verify contact page responsive","chromium","2026-03-30","passed","2026-03-30","","estimator.spec.js","",""
"","1203","Verify clicking multiple bikes works","chromium","2026-03-30","passed","2026-03-30","","browsebike.spec.js","",""
"","548","Verify contact page title","chromium","2026-03-30","passed","2026-03-30","","estimator.spec.js","",""
"","848","fullname and age only","chromium","2026-03-30","passed","2026-03-30","","register.spec.js","",""
"","0","checking with 4 details brandName,model,original price and year","chromium","2026-03-25","skipped","2026-03-25","","sell.spec.js","",""
"","4909","checking for myorders functional block","firefox","2026-03-25","passed","2026-03-25","","dashboard.spec.js","",""
"","329","has title","chromium","2026-03-30","passed","2026-03-30","","example.spec.js","",""
"","4933","checking for Active Chats functional block","webkit","2026-03-25","passed","2026-03-25","","dashboard.spec.js","",""
"","1296","Verify no console errors (basic)","chromium","2026-03-30","passed","2026-03-30","","messgaes.spec.js","",""
"","5867","Verify estimated price calculation without km driven","firefox","2026-03-25","passed","2026-03-25","","sell.spec.js","",""
"","0","invalid email and valid password","firefox","2026-03-25","skipped","2026-03-25","","loginModule.spec.js","",""
"","3857","fullname with special characters","webkit","2026-03-25","passed","2026-03-25","","register.spec.js","",""
"","2825","Trying to register again with same details","webkit","2026-03-25","passed","2026-03-25","","register.spec.js","",""
"","4714","listing a bike with discription","chromium","2026-03-25","passed","2026-03-25","","sell.spec.js","",""
"","2693","only age entered","webkit","2026-03-25","passed","2026-03-25","","register.spec.js","",""
"","1799","checking for the functionality of second View all which navigates orders page","chromium","2026-03-30","passed","2026-03-30","","dashboard.spec.js","",""
"","2835","fullname and password only","webkit","2026-03-25","passed","2026-03-25","","register.spec.js","",""
"","1200","Verify user remains logged in","chromium","2026-03-30","passed","2026-03-30","","messgaes.spec.js","",""
"","0","invalid email format","webkit","2026-03-25","skipped","2026-03-25","","register.spec.js","",""
"","802","correct login","chromium","2026-03-30","passed","2026-03-30","","loginModule.spec.js","",""
"","3451","password less than 6 characters","firefox","2026-03-25","passed","2026-03-25","","register.spec.js","",""
"","15316","Verify listing failure when mandatory fields are filled without km driven","webkit","2026-03-25","failed","2026-03-25","","sell.spec.js","",""
"","837","trying to register with only fullname","chromium","2026-03-30","passed","2026-03-30","","register.spec.js","",""
"","4288","checking for the functionality of first View all link","firefox","2026-03-25","passed","2026-03-25","","dashboard.spec.js","",""
"","5096","checking Estimator button functionality","firefox","2026-03-25","passed","2026-03-25","","dashboard.spec.js","",""
"","2270","Trying to register again with same details","firefox","2026-03-25","passed","2026-03-25","","register.spec.js","",""
"","1250","Verify page title","chromium","2026-03-30","passed","2026-03-30","","messgaes.spec.js","",""
"","0","invalid email format","chromium","2026-03-30","skipped","2026-03-30","","register.spec.js","",""
"","570","Verify navigation back from contact","chromium","2026-03-30","passed","2026-03-30","","estimator.spec.js","",""
"","817","Trying to create account with fullname and email","chromium","2026-03-30","passed","2026-03-30","","register.spec.js","",""
"","1358","Verify bike price is visible","chromium","2026-03-30","passed","2026-03-30","","browsebike.spec.js","",""
"","647","Verify estimator page responsive","chromium","2026-03-30","passed","2026-03-30","","estimator.spec.js","",""
"","1","filling brand name and model name of the bike and trying to list with two details","chromium","2026-03-25","skipped","2026-03-25","","sell.spec.js","",""
"","30059","","chromium","2026-03-23","broken","2026-03-23","","dashboard.spec.js","",""
"","1","Asserting the bike value when we hit the estimator button with km travelled","chromium","2026-03-25","skipped","2026-03-25","","sell.spec.js","",""
"","4700","checking Messages button functionality","webkit","2026-03-25","passed","2026-03-25","","dashboard.spec.js","",""
"","5197","checking for the functionality of first View all link","webkit","2026-03-25","passed","2026-03-25","","dashboard.spec.js","",""
"","5487","Verify successful listing without description","webkit","2026-03-25","passed","2026-03-25","","sell.spec.js","",""
