"DESCRIPTION","DURATION IN MS","NAME","PARENT SUITE","START TIME","STATUS","STOP TIME","SUB SUITE","SUITE","TEST CLASS","TEST METHOD"
"","0","filling brand name and model name of the bike and trying to list with two details","chromium","2026-03-25","skipped","2026-03-25","","browse.spec.js","",""
"","4818","Verify validation when brand and model are provided","firefox","2026-03-25","passed","2026-03-25","","sell.spec.js","",""
"","789","only age entered","chromium","2026-03-30","passed","2026-03-30","","register.spec.js","",""
"","1378","Verify bikes are displayed","chromium","2026-03-30","passed","2026-03-30","","browsebike.spec.js","",""
"","5056","checking for Browse available bikes link navigates to browse bike page","webkit","2026-03-25","passed","2026-03-25","","dashboard.spec.js","",""
"","5066","checking for password whose length is less than 6 characters","firefox","2026-03-25","passed","2026-03-25","","register.spec.js","",""
"","5316","Verify validation when attempting to publish listing without entering any details","firefox","2026-03-25","passed","2026-03-25","","sell.spec.js","",""
"","1","pressing the estimator button to check the price of a bike","chromium","2026-03-25","skipped","2026-03-25","","sell.spec.js","",""
"","6047","checking Contact button functionality","webkit","2026-03-25","passed","2026-03-25","","dashboard.spec.js","",""
"","931","has title","firefox","2026-03-25","passed","2026-03-25","","example.spec.js","",""
"","1","filling only brand name to list the bike","chromium","2026-03-25","skipped","2026-03-25","","sell.spec.js","",""
"","816","fullname and password only","chromium","2026-03-30","passed","2026-03-30","","register.spec.js","",""
"","2779","fullname and password only","firefox","2026-03-25","passed","2026-03-25","","register.spec.js","",""
"","5770","Verify estimated price calculation without km driven","webkit","2026-03-25","passed","2026-03-25","","sell.spec.js","",""
"","7","clicking publishlisting button it should ask for the bike details","chromium","2026-03-25","skipped","2026-03-25","","sell.spec.js","",""
"","1409","Verify navigation back to listings","chromium","2026-03-30","passed","2026-03-30","","browsebike.spec.js","",""
"","12343","Verify listing failure when mandatory fields are filled without km driven","chromium","2026-03-30","failed","2026-03-30","","sell.spec.js","",""
"","3007","correct login","webkit","2026-03-25","passed","2026-03-25","","loginModule.spec.js","",""
"","2455","email and password only","firefox","2026-03-25","passed","2026-03-25","","register.spec.js","",""
"","1330","Verify bike image section exists","chromium","2026-03-30","passed","2026-03-30","","browsebike.spec.js","",""
"","488","Checking visibility of price estimator on login page","chromium","2026-03-30","passed","2026-03-30","","loginModule.spec.js","",""
"","1","pressing the estimator button to check the price of a bike","chromium","2026-03-25","skipped","2026-03-25","","browse.spec.js","",""
"","0","checking Homepage Mylisting fuctional block","chromium","2026-03-23","skipped","2026-03-23","","dashboard.spec.js","",""
"","30099","Login success - mock user API","webkit","2026-03-23","broken","2026-03-23","","userLoginDetails.spec.js","",""
"","1394","Verify logout from chat page","chromium","2026-03-30","passed","2026-03-30","","messgaes.spec.js","",""
"","0","Asserting the bike value when we hit the estimator button","chromium","2026-03-25","skipped","2026-03-25","","browse.spec.js","",""
"","3949","fds","firefox","2026-03-24","failed","2026-03-24","","browse.spec.js","",""
"","1759","checking for the functionality of first View all link","chromium","2026-03-30","passed","2026-03-30","","dashboard.spec.js","",""
"","891","password less than 6 characters","chromium","2026-03-30","passed","2026-03-30","","register.spec.js","",""
"","14867","Verify listing failure when mandatory fields are filled without km driven","firefox","2026-03-25","failed","2026-03-25","","sell.spec.js","",""
"","1","listing a bike eithout discription","chromium","2026-03-25","skipped","2026-03-25","","browse.spec.js","",""
"","1320","Verify validation when attempting to publish listing without entering any details","chromium","2026-03-30","passed","2026-03-30","","sell.spec.js","",""
"","860","API booking creation with invalid data shows error","chromium","2026-03-30","passed","2026-03-30","","payment-api.spec.js","",""
"","854","age below 18 and missing password","chromium","2026-03-30","passed","2026-03-30","","register.spec.js","",""
"","4606","Verify successful listing with description and additional data","firefox","2026-03-25","passed","2026-03-25","","sell.spec.js","",""
"","1314","Verify validation when brand, model, and year are provided","chromium","2026-03-30","passed","2026-03-30","","sell.spec.js","",""
"","1345","Verify page is responsive (mobile)","chromium","2026-03-30","passed","2026-03-30","","browsebike.spec.js","",""
"","1468","checking the contact page visibility","webkit","2026-03-25","passed","2026-03-25","","loginModule.spec.js","",""
"","1215","Verify navigation back to dashboard","chromium","2026-03-30","passed","2026-03-30","","messgaes.spec.js","",""
"","5432","checking Browse bike functionality","webkit","2026-03-25","passed","2026-03-25","","dashboard.spec.js","",""
"","4","checking Browse bike funcationality","chromium","2026-03-23","skipped","2026-03-23","","dashboard.spec.js","",""
"","1283","checking for the second sell bike button","chromium","2026-03-30","passed","2026-03-30","","dashboard.spec.js","",""
"","4391","Verify estimated price calculation without km driven","chromium","2026-03-25","passed","2026-03-25","","sell.spec.js","",""
"","1217","Verify multiple bikes exist","chromium","2026-03-30","skipped","2026-03-30","","browsebike.spec.js","",""
"","3501","Verify successful listing with description and additional data","chromium","2026-03-25","passed","2026-03-25","","sell.spec.js","",""
"","8345","Verify estimated price calculation with km driven","firefox","2026-03-25","passed","2026-03-25","","sell.spec.js","",""
"","2172","fullname and age only","firefox","2026-03-25","passed","2026-03-25","","register.spec.js","",""
"","3937","age below 18 and missing password","firefox","2026-03-25","passed","2026-03-25","","register.spec.js","",""
"","1224","checking Browse bike functionality","chromium","2026-03-30","passed","2026-03-30","","dashboard.spec.js","",""
"","3370","checking My Orders button functionality","firefox","2026-03-25","passed","2026-03-25","","dashboard.spec.js","",""
"","4217","Verify validation when brand, model, year, and price are provided","firefox","2026-03-25","passed","2026-03-25","","sell.spec.js","",""
"","1328","Verify grid layout is present","chromium","2026-03-30","passed","2026-03-30","","browsebike.spec.js","",""
"","1246","Verify multiple DOM elements exist","chromium","2026-03-30","passed","2026-03-30","","messgaes.spec.js","",""
"","6668","Verify successful listing with description","webkit","2026-03-25","passed","2026-03-25","","sell.spec.js","",""
"","0","checking with 4 details brandName,model,original price and year","chromium","2026-03-25","skipped","2026-03-25","","browse.spec.js","",""
"","1498","Conforming the current page is register page","firefox","2026-03-25","passed","2026-03-25","","register.spec.js","",""
"","30059","checking for Create your first listing link functionality","chromium","2026-03-23","broken","2026-03-23","","dashboard.spec.js","",""
"","4127","checking for Browse available bikes link navigates to browse bike page","firefox","2026-03-25","passed","2026-03-25","","dashboard.spec.js","",""
"","4928","checking Estimator button functionality","webkit","2026-03-25","passed","2026-03-25","","dashboard.spec.js","",""
"","563","Verify navigation back from estimator","chromium","2026-03-30","passed","2026-03-30","","estimator.spec.js","",""
"","15255","Verify price estimation functionality for bike","firefox","2026-03-25","failed","2026-03-25","","sell.spec.js","",""
"","4244","checking for the functionality of second View all which navigates orders page","firefox","2026-03-25","passed","2026-03-25","","dashboard.spec.js","",""
"","0","checking with 3 details brandName,model and year for listing","chromium","2026-03-25","skipped","2026-03-25","","browse.spec.js","",""
"","1591","API booking history retrieval after login","chromium","2026-03-30","passed","2026-03-30","","payment-api.spec.js","",""
"","840","API payment processing with invalid booking ID shows error","chromium","2026-03-30","passed","2026-03-30","","payment-api.spec.js","",""
"","2580","checking hyperlink of create account","webkit","2026-03-25","passed","2026-03-25","","loginModule.spec.js","",""
"","1290","checking sellBike button functionality","chromium","2026-03-30","passed","2026-03-30","","dashboard.spec.js","",""
"","3718","Verify successful listing with description","firefox","2026-03-25","passed","2026-03-25","","sell.spec.js","",""
"","4894","checking for Active Chats functional block","firefox","2026-03-25","passed","2026-03-25","","dashboard.spec.js","",""
"","8602","Verify estimated price calculation with km driven","webkit","2026-03-25","passed","2026-03-25","","sell.spec.js","",""
"","1820","checking for Browse available bikes link navigates to browse bike page","chromium","2026-03-30","passed","2026-03-30","","dashboard.spec.js","",""
"","0","invalid email and valid password","chromium","2026-03-30","skipped","2026-03-30","","loginModule.spec.js","",""
"","802","checking for the logo visibility","chromium","2026-03-30","passed","2026-03-30","","dashboard.spec.js","",""
"","6735","Verify validation when attempting to publish listing without entering any details","webkit","2026-03-25","passed","2026-03-25","","sell.spec.js","",""
"","4218","Verify validation when brand, model, and year are provided","firefox","2026-03-25","passed","2026-03-25","","sell.spec.js","",""
"","1169","Verify page title","chromium","2026-03-30","passed","2026-03-30","","orders.spec.js","",""
"","5912","checking for password whose length is less than 6 characters","webkit","2026-03-25","passed","2026-03-25","","register.spec.js","",""
"","2640","checking the contact page visibility","firefox","2026-03-25","passed","2026-03-25","","loginModule.spec.js","",""
"","2909","checking for the logo visibility","webkit","2026-03-25","passed","2026-03-25","","dashboard.spec.js","",""
"","833","email only validation","chromium","2026-03-30","passed","2026-03-30","","loginModule.spec.js","",""
"","1836","fds","chromium","2026-03-24","passed","2026-03-24","","browse.spec.js","",""
"","3133","checking hyperlink of create account","firefox","2026-03-25","passed","2026-03-25","","loginModule.spec.js","",""
"","1164","Verify multiple DOM elements exist","chromium","2026-03-30","passed","2026-03-30","","orders.spec.js","",""
"","510","signup button is visible","chromium","2026-03-30","passed","2026-03-30","","loginModule.spec.js","",""
"","4571","Verify successful listing without description","firefox","2026-03-25","passed","2026-03-25","","sell.spec.js","",""
"","0","checking for the functionality of second View all which navigates ordes page","chromium","2026-03-23","skipped","2026-03-23","","dashboard.spec.js","",""
"","7257","checking for thr functionality of View all link","chromium","2026-03-23","passed","2026-03-23","","dashboard.spec.js","",""
"","1863","checking the copyright licence","webkit","2026-03-25","passed","2026-03-25","","loginModule.spec.js","",""
"","43","API booking history retrieval without authentication shows error","chromium","2026-03-30","passed","2026-03-30","","payment-api.spec.js","",""
"","1351","Verify session persists after reload","chromium","2026-03-30","passed","2026-03-30","","orders.spec.js","",""
"","1188","Verify chat page loads","chromium","2026-03-30","passed","2026-03-30","","messgaes.spec.js","",""
"","1358","Verify bike km driven icon exists","chromium","2026-03-30","passed","2026-03-30","","browsebike.spec.js","",""
"","1695","Checking visibility of price estimator on login page","firefox","2026-03-25","passed","2026-03-25","","loginModule.spec.js","",""
"","1227","Verify no crash on load","chromium","2026-03-30","passed","2026-03-30","","messgaes.spec.js","",""
"","9915","checking for the functionality of second View all link","chromium","2026-03-23","failed","2026-03-23","","dashboard.spec.js","",""
"","6","clicking publishlisting button it should ask for the bike details","chromium","2026-03-25","skipped","2026-03-25","","browse.spec.js","",""
"","1260","Verify no crash on page load","chromium","2026-03-30","passed","2026-03-30","","browsebike.spec.js","",""
"","3125","Enter all valid details but age should be below 20","webkit","2026-03-25","passed","2026-03-25","","register.spec.js","",""
"","538","get started link","chromium","2026-03-30","passed","2026-03-30","","example.spec.js","",""
"","801","Enter all valid details but age should be below 20","chromium","2026-03-30","passed","2026-03-30","","register.spec.js","",""
"","1276","get started link","webkit","2026-03-25","passed","2026-03-25","","example.spec.js","",""
"","2980","email and password only","webkit","2026-03-25","passed","2026-03-25","","register.spec.js","",""
"","1330","Verify user remains on listings page after reload","chromium","2026-03-30","passed","2026-03-30","","browsebike.spec.js","",""
"","30112","Login success - mock user API","firefox","2026-03-23","broken","2026-03-23","","userLoginDetails.spec.js","",""
"","2125","has title","firefox","2026-03-25","passed","2026-03-25","","loginModule.spec.js","",""
"","1224","Verify orders presence or empty state","chromium","2026-03-30","passed","2026-03-30","","orders.spec.js","",""
"","5162","Verify validation when only brand is provided","firefox","2026-03-25","passed","2026-03-25","","sell.spec.js","",""
"","2182","Trying to create account with fullname and email","firefox","2026-03-25","passed","2026-03-25","","register.spec.js","",""
"","1719","checking My Orders button functionality","chromium","2026-03-30","passed","2026-03-30","","dashboard.spec.js","",""
"","0","checking for the second sell bike button","chromium","2026-03-23","skipped","2026-03-23","","dashboard.spec.js","",""
"","2522","correct login","firefox","2026-03-25","passed","2026-03-25","","loginModule.spec.js","",""
"","4783","Verify validation when brand and model are provided","webkit","2026-03-25","passed","2026-03-25","","sell.spec.js","",""
"","1200","Verify responsive view (mobile)","chromium","2026-03-30","passed","2026-03-30","","messgaes.spec.js","",""
"","2468","API payment processing after booking","chromium","2026-03-30","passed","2026-03-30","","payment-api.spec.js","",""
"","2984","fullname with special characters","firefox","2026-03-25","passed","2026-03-25","","register.spec.js","",""
"","8142","Asserting the bike value when we hit the estimator button with km travelled","chromium","2026-03-25","passed","2026-03-25","","browse.spec.js","",""
"","4757","checking Homepage Mylisting functional block","firefox","2026-03-25","passed","2026-03-25","","dashboard.spec.js","",""
"","1296","Verify refresh keeps chat page","chromium","2026-03-30","passed","2026-03-30","","messgaes.spec.js","",""
"","1358","Verify validation when brand and model are provided","chromium","2026-03-30","passed","2026-03-30","","sell.spec.js","",""
"","1262","Verify navigation back to dashboard","chromium","2026-03-30","passed","2026-03-30","","orders.spec.js","",""
"","6775","Verify estimated price calculation with km driven","chromium","2026-03-25","passed","2026-03-25","","sell.spec.js","",""
"","1177","Verify page scroll works","chromium","2026-03-30","passed","2026-03-30","","orders.spec.js","",""
"","2653","signup button is visible","webkit","2026-03-25","passed","2026-03-25","","loginModule.spec.js","",""
"","4937","checking sellBike button functionality","webkit","2026-03-25","passed","2026-03-25","","dashboard.spec.js","",""
"","5445","checking Browse bike functionality","firefox","2026-03-25","passed","2026-03-25","","dashboard.spec.js","",""
"","484","checking the contact page visibility","chromium","2026-03-30","passed","2026-03-30","","loginModule.spec.js","",""
"","3620","checking Contact button functionality","firefox","2026-03-25","passed","2026-03-25","","dashboard.spec.js","",""
"","1255","checking Contact button functionality","chromium","2026-03-30","passed","2026-03-30","","dashboard.spec.js","",""
"","0","checking Messages button funcationalitu","chromium","2026-03-23","skipped","2026-03-23","","dashboard.spec.js","",""
"","5460","Verify validation when brand, model, year, and price are provided","webkit","2026-03-25","passed","2026-03-25","","sell.spec.js","",""
"","2181","email only validation","firefox","2026-03-25","passed","2026-03-25","","loginModule.spec.js","",""
"","1348","Verify refresh keeps orders page","chromium","2026-03-30","passed","2026-03-30","","orders.spec.js","",""
"","1214","Verify page is visible","chromium","2026-03-30","passed","2026-03-30","","orders.spec.js","",""
"","858","Trying to register again with same details","chromium","2026-03-30","passed","2026-03-30","","register.spec.js","",""
"","5432","Verify successful listing with description and additional data","webkit","2026-03-25","passed","2026-03-25","","sell.spec.js","",""
"","6101","checking sellBike button functionality","firefox","2026-03-25","passed","2026-03-25","","dashboard.spec.js","",""
"","0","invalid email format","firefox","2026-03-25","skipped","2026-03-25","","register.spec.js","",""
"","2761","Trying to create account with fullname and email","webkit","2026-03-25","passed","2026-03-25","","register.spec.js","",""
"","1354","Verify bike location text exists","chromium","2026-03-30","passed","2026-03-30","","browsebike.spec.js","",""
"","1296","checking logout button functionality","chromium","2026-03-30","passed","2026-03-30","","dashboard.spec.js","",""
"","3397","age below 18 and missing password","webkit","2026-03-25","passed","2026-03-25","","register.spec.js","",""
"","1","listing a bike with all mendatory required data without km driven","chromium","2026-03-25","skipped","2026-03-25","","browse.spec.js","",""
"","6","login and save state","firefox","2026-03-24","failed","2026-03-24","","auth.setup.spec.js","",""
"","0","invalid email and valid password","webkit","2026-03-25","skipped","2026-03-25","","loginModule.spec.js","",""
"","1683","Verify page reload keeps bikes","chromium","2026-03-30","passed","2026-03-30","","browsebike.spec.js","",""
"","3873","checking for password whose length is less than 6 characters","chromium","2026-03-30","passed","2026-03-30","","register.spec.js","",""
"","1","filling only brand name to list the bike","chromium","2026-03-25","skipped","2026-03-25","","browse.spec.js","",""
"","50","API booking creation without authentication shows error","chromium","2026-03-30","passed","2026-03-30","","payment-api.spec.js","",""
"","525","Verify no console errors (basic)","chromium","2026-03-30","passed","2026-03-30","","estimator.spec.js","",""
"","1279","Verify validation when only brand is provided","chromium","2026-03-30","passed","2026-03-30","","sell.spec.js","",""
"","1968","checking for the logo visibility","firefox","2026-03-25","passed","2026-03-25","","dashboard.spec.js","",""
"","6255","checking logout button functionality","webkit","2026-03-25","passed","2026-03-25","","dashboard.spec.js","",""
"","1812","checking Homepage Mylisting functional block","chromium","2026-03-30","passed","2026-03-30","","dashboard.spec.js","",""
"","2905","password less than 6 characters","webkit","2026-03-25","passed","2026-03-25","","register.spec.js","",""
"","1220","Verify user stays logged in","chromium","2026-03-30","passed","2026-03-30","","orders.spec.js","",""
"","1045","Conforming the current page is register page","webkit","2026-03-25","passed","2026-03-25","","register.spec.js","",""
"","1246","checking Messages button functionality","chromium","2026-03-30","passed","2026-03-30","","dashboard.spec.js","",""
"","1260","Verify scroll works in chat page","chromium","2026-03-30","passed","2026-03-30","","messgaes.spec.js","",""
"","3976","Verify successful listing with description","chromium","2026-03-25","passed","2026-03-25","","sell.spec.js","",""
"","5298","Verify validation when brand, model, and year are provided","webkit","2026-03-25","passed","2026-03-25","","sell.spec.js","",""
"","0","listing a bike with all mendatory required data without km driven","chromium","2026-03-25","skipped","2026-03-25","","sell.spec.js","",""
"","46","API payment processing without authentication shows error","chromium","2026-03-30","passed","2026-03-30","","payment-api.spec.js","",""
"","12047","Verify price estimation functionality for bike","chromium","2026-03-30","failed","2026-03-30","","sell.spec.js","",""
"","2692","Login success - mock user API","chromium","2026-03-23","passed","2026-03-23","","userLoginDetails.spec.js","",""
"","4860","checking My Orders button functionality","webkit","2026-03-25","passed","2026-03-25","","dashboard.spec.js","",""
"","1228","Verify no crash on load","chromium","2026-03-30","passed","2026-03-30","","orders.spec.js","",""
"","3993","fds","webkit","2026-03-24","failed","2026-03-24","","browse.spec.js","",""
"","859","checking hyperlink of create account","chromium","2026-03-30","passed","2026-03-30","","loginModule.spec.js","",""
"","1570","Checking visibility of price estimator on login page","webkit","2026-03-25","passed","2026-03-25","","loginModule.spec.js","",""
"","534","Verify contact page UI loads","chromium","2026-03-30","passed","2026-03-30","","estimator.spec.js","",""
"","1317","Verify session persists after reload","chromium","2026-03-30","passed","2026-03-30","","messgaes.spec.js","",""
"","1230","Verify logout from orders page","chromium","2026-03-30","passed","2026-03-30","","orders.spec.js","",""
"","3074","Enter all valid details but age should be below 20","firefox","2026-03-25","passed","2026-03-25","","register.spec.js","",""
"","1720","Verify orders page loads","chromium","2026-03-30","passed","2026-03-30","","orders.spec.js","",""
"","1294","Verify responsive view (mobile)","chromium","2026-03-30","passed","2026-03-30","","orders.spec.js","",""
"","587","Verify estimator page UI loads","chromium","2026-03-30","passed","2026-03-30","","estimator.spec.js","",""
"","344","Conforming the current page is register page","chromium","2026-03-30","passed","2026-03-30","","register.spec.js","",""
"","848","has title","webkit","2026-03-25","passed","2026-03-25","","example.spec.js","",""
"","1295","Verify validation when brand, model, year, and price are provided","chromium","2026-03-30","passed","2026-03-30","","sell.spec.js","",""
"","1757","checking for Active Chats functional block","chromium","2026-03-30","passed","2026-03-30","","dashboard.spec.js","",""
"","1263","Verify no console errors (basic)","chromium","2026-03-30","passed","2026-03-30","","orders.spec.js","",""
"","5405","checking Homepage Mylisting functional block","webkit","2026-03-25","passed","2026-03-25","","dashboard.spec.js","",""
"","5106","checking for the functionality of second View all which navigates orders page","webkit","2026-03-25","passed","2026-03-25","","dashboard.spec.js","",""
"","6","login and save state","chromium","2026-03-24","failed","2026-03-24","","auth.setup.spec.js","",""
"","2995","Verify listings page loads","chromium","2026-03-30","passed","2026-03-30","","browsebike.spec.js","",""
"","5836","checking for myorders functional block","webkit","2026-03-25","passed","2026-03-25","","dashboard.spec.js","",""
"","575","Verify no crash on estimator page","chromium","2026-03-30","passed","2026-03-30","","estimator.spec.js","",""
"","2008","trying to register with only fullname","firefox","2026-03-25","passed","2026-03-25","","register.spec.js","",""
"","5","login and save state","webkit","2026-03-24","failed","2026-03-24","","auth.setup.spec.js","",""
"","1084","has title","webkit","2026-03-25","passed","2026-03-25","","loginModule.spec.js","",""
"","2871","signup button is visible","firefox","2026-03-25","passed","2026-03-25","","loginModule.spec.js","",""
"","5747","listing a bike with discription and url","chromium","2026-03-25","passed","2026-03-25","","sell.spec.js","",""
"","4051","checking logout button functionality","firefox","2026-03-25","passed","2026-03-25","","dashboard.spec.js","",""
"","4990","checking for the second sell bike button","webkit","2026-03-25","passed","2026-03-25","","dashboard.spec.js","",""
"","0","Asserting the bike value when we hit the estimator button","chromium","2026-03-25","skipped","2026-03-25","","sell.spec.js","",""
"","767","API payment processing with invalid card details shows error","chromium","2026-03-30","passed","2026-03-30","","payment-api.spec.js","",""
"","849","fullname with special characters","chromium","2026-03-30","passed","2026-03-30","","register.spec.js","",""
"","4033","navigating to sell browser","chromium","2026-03-24","passed","2026-03-24","","browse.spec.js","",""
"","1287","Verify direct URL navigation works","chromium","2026-03-30","passed","2026-03-30","","orders.spec.js","",""
"","0","listing a bike without discription","chromium","2026-03-25","skipped","2026-03-25","","sell.spec.js","",""
"","1276","checking Estimator button functionality","chromium","2026-03-30","passed","2026-03-30","","dashboard.spec.js","",""
"","2736","checking for myorders functional block","chromium","2026-03-30","passed","2026-03-30","","dashboard.spec.js","",""
"","442","has title","chromium","2026-03-30","passed","2026-03-30","","loginModule.spec.js","",""
"","1224","Verify chat list or empty state","chromium","2026-03-30","passed","2026-03-30","","messgaes.spec.js","",""
"","1151","get started link","firefox","2026-03-25","passed","2026-03-25","","example.spec.js","",""
